{"a": true, "c": true, "code": "MDA13", "description": "Logiciel non d\u00e9sir\u00e9 executant des op\u00e9rations cherchant \u00e0 nuire \u00e0 l'organisme.", "i": true, "label": "Infection par un malware", "language": "FR", "theme": "Compromission des informations", "uuid": "b402d5d5-4576-11e9-9173-0800277f0571"}