{"a": false, "c": true, "code": "MD15", "description": "Someone connected to communication equipment or media or located inside the transmission coverage boundaries of a communication.", "i": false, "label": "Eavesdropping", "language": "EN", "theme": "Compromise of functions", "uuid": "b402d557-4576-11e9-9173-0800277f0571"}