{"a": true, "c": true, "code": "MD14", "description": "Jemand gibt sich als jemand anderes aus, um sich mit dessen Zugriffsprivilegien Zugang zum IT-System zu verschaffen, den Empf\u00e4nger falsch zu informieren, eine betr\u00fcgerische Tat auszuf\u00fchren usw.\n", "i": true, "label": "Rechtsanmassung", "language": "DE", "theme": "Infragestellung von Funktionen", "uuid": "b402d530-4576-11e9-9173-0800277f0571"}