{"a": true, "c": true, "code": "MD36", "description": "Die Datentr\u00e4ger, Dokumente oder Betriebsmittel sind f\u00fcr Fremde, entweder intern oder extern, zug\u00e4nglich. Sie k\u00f6nnen zerst\u00f6rt oder gestohlen werden\n", "i": false, "label": "Entwenden oder Zerst\u00f6ren von Speichermedien, Dokumenten oder Datentr\u00e4ger", "language": "DE", "theme": "Infragestellung von Informationen", "uuid": "b402d5af-4576-11e9-9173-0800277f0571"}